"ID","Nome","Indirizzo","Delivery","Prenotazione online","Tipo cucina","Prezzo","Descrizione","Latitudine","Longitudine"
"658","Palazzo Utini","via Antonio Gramsci 6, Noceto, 43015, Italy","True","False","Creative","€€€€","This historic building in the town centre has been brought back to life by the family of local entrepreneurs who bought it years ago and who have given the restaurant their name. Now an exclusive food venue just a stone’s throw from the capital of the “Food Valley” region, Palazzo Utini is home to a bar and bistro on its ground floor, while the first floor is occupied by the gourmet restaurant overseen by chef Enrico Bartolini and run by resident chef Roberto Monopoli who has plenty of culinary experience behind him. Guests can choose individual dishes from the tasting menus à la carte style, plus there’s an extensive wine list. We particularly enjoyed the exquisite turbot saltimbocca and the onion, black cherry and Lambrusco dessert. On the upper floors, elegant and intimate guestrooms are decorated in the same reassuring style as the rest of the building.","44.8087145","10.1788721"
"659","Soul & Fish","via Marina Grande, Sorrento, 80067, Italy","False","False","Seafood","€€€","From the centre of Sorrento, you follow a succession of roads downhill to Marina Grande, the town’s old, picturesque fishing village that is well worth a visit. Here, facing the water, you’ll find Soul & Fish, a seemingly traditional seaside restaurant that actually serves superb fish and seafood on a menu that combines traditional dishes with more creative options.","40.6278681","14.3644213"
"660","Etra","piazza De Ferrari 4, Genoa, 16121, Italy","True","True","Creative","€€€","Etra is an anagram of the Italian word “arte” – an apt name for this restaurant, which is housed in Palazzo Doria De Fornari on the beautiful and famous Piazza Ferrari. This palazzo is one of Genova’s magnificent “Rolli” palazzi (noble palaces once used to house famous visitors to the city). Despite the setting, the dining room is modern in style and adorned with elegant works of contemporary art. Here, chef Davide Cannavino consolidates his reputation with a concise menu of creative dishes: around a dozen meat and fish options inspired by the beauty that surrounds him and showcased on two tasting menus from which individual dishes can be chosen à la carte style.","44.4081985","8.9341693"
"661","20Tre","via David Chiossone 20 r, Genoa, 16123, Italy","False","True","Farm to table","€€","Run by three partners, this contemporary-style restaurant is situated in the heart of Genova’s historic centre. The cuisine here is prepared using the best seasonal ingredients, all presented in an array of modern dishes. Meat and fish feature on the menu, with a focus on regional recipes and the occasional Asian twist (for example, the amberjack and ponzu bonbon).","44.4087805","8.9331148"
"662","Ménage","Via Euplio Reina 13, Catania, 95121, Italy","False","False","Sicilian","€€","Situated in the heart of the city near the Teatro Bellini and Piazza Università, this restaurant occupies an Art Nouveau-style building. Here, a trio of experienced young chefs from Catania have brought new life to the old “Da Turi Finocchiaro” restaurant, which has always been very popular with the city’s high society. Offering a small outdoor space near the entrance, the quiet, intimate dining room on the ground floor provides the backdrop for reinterpreted, contemporary Sicilian cuisine with an exclusive focus on meat (especially barbecued dishes which are the restaurant’s trademark), while the first floor is home to a cocktail bar run with passion by one of the partners. Two frescoes painted by Giuseppe Barone in 1930 add to the appeal.","37.5040814","15.088074"
"663","Procaccini","Via Giulio Cesare Procaccini 33, Milan, 20154, Italy","False","False","Modern Cuisine","€€€€","Originally from Kosovo, talented chef Emin Haziri grew up in Italy and has plenty of professional culinary experience behind him. Here, he creates contemporary cuisine with a personal flavour, with raw seafood dishes such as oysters, caviar, Sicilian prawns and scampi available alongside his more imaginative options. In the elegant and stylish dining room with a harmonious colour scheme and fine furnishings, the open-view kitchen and marble chef’s table with velvet-covered stools really catch the eye. The restaurant also boasts a cocktail bar where guests can enjoy a drink and appetisers from the small tapas menu which is designed for sharing.","45.4837396","9.1708465"
"664","Metodo","via Vittorio Emanuele 9, Marne, 24040, Italy","True","True","Creative","€€€","In the romantic setting of an 18C farmhouse, this restaurant has a rustic dining room enhanced by its elegant decor and furnishings, such as the solid maple tables and refined cutlery. The cuisine is showcased on two tasting menus (from which dishes can also be chosen individually) which are creative and occasionally very elaborate in style.","45.6223626","9.5583004"
"665","Gimmy's","via privata Gemelli, Aprica, 23031, Italy","False","True","Italian","€€","Traditional cuisine reinterpreted with a modern twist, with a whole page of the menu dedicated to meat dishes. Meals are served in an attractive Stube-style room with a warm mountain ambience.","46.1535475","10.1517783"
"666","Locanda Perbellini - Ai Beati","via Val Mora 57, Garda, 37016, Italy","False","False","Contemporary","€€€","Situated amid the foothills around Garda, this restaurant boasts fine views from its verdant terrace which take in much of the southern part of the lake, while its dining rooms occupy the interior of an old olive mill. The menu features freshwater fish such as pike and whitefish as well as seafood and meat dishes.","45.5861354","10.7174171"
"667","Salvo","Riviera di Chiaia 271, Naples, 80121, Italy","False","True","Pizza","€","Situated opposite the Villa Comunale gardens, this restaurant serves some of the best pizzas in Naples (classic Neapolitan-style pizza which is soft and so big that it spills over the plate) as well as a selection of delicious appetisers, such as superb pasta fritters with various toppings. Welcoming ambience, with a more elegant feel than that of a typical pizzeria.","40.8333521","14.2390896"
"668","Innesti","via San Pietro 8, Pergine Valsugana, 38057, Italy","False","True","Modern Cuisine","€€","Daniele and Elisa are a couple of young restaurateurs who are familiar to us from their time at Blumenstube in Sant'Orsola. Having moved on, they have now opened their own restaurant in Pergine, where both the decor and the cuisine are contemporary-Alpine in style. As in currently in vogue, their dishes are showcased on three tasting menus (short, medium and long) from which dishes can also be chosen à la carte style. All the recipes have a creative feel, demonstrating the chef’s playful approach to his contemporary ingredients.","46.062605","11.2442274"
"669","Osteria del Teatro","via Maffei 2, Cortona, 52044, Italy","False","False","Tuscan","€€","Enjoy traditional cuisine served in an elegant 16C dining room with a fireplace or in more informal trattoria-style rooms, all of which are decorated with the same theatrical theme. The recipes here focus on local traditions and seasonal ingredients, resulting in colourful, well-balanced and beautifully presented dishes that are full of flavour. There are just a few tables on the small terrace near the entrance overlooking the pedestrianised street, so if you want to sit outdoors make sure you book well in advance.","43.2758393","11.9857699"
"670","Anticofurlo","via Furlo 60, Acqualagna, 61041, Italy","True","False","Cuisine from the Marches","€€","Situated in the Gola del Furlo nature reserve, this restaurant is run by the talented and enthusiastic Alberto and Roberta, whose focus is on typical Marche specialities such as fresh pasta, cured hams, fine cheese and regional dishes full of intense flavours. The picturesque grotto carved into the rock is perfect for an aperitif, while the inn also offers charming guestrooms.","43.6384218","12.7132896"
"671","Lupaia","Località Lupaia 74, Torrita di Siena, 53049, Italy","True","True","Country cooking","€€€","Situated in a charming Tuscan hamlet nestled in the hills between Montepulciano and Montefollonico, this restaurant boasts stunning sunset views from its garden in the summer months, while guests in the dining room can enjoy views of the open kitchen in winter. The cuisine changes daily, with the chef offering a tasting menu based largely around produce from his own farm. The journey to get here is bucolic to say the least – an occasionally tortuous dirt track of more than 2km which requires careful driving! Booking ahead is essential if you’re not staying in the hotel.","43.1135781","11.7501772"
"672","Joca","vico Sospiri 10/C, Naples, 80121, Italy","False","False","Modern Cuisine","€€€","In a modern, trendy setting, chef Gianluca D'Agostino prepares creative gourmet cuisine with the occasional Campanian influence. In addition to this, in a separate part of the restaurant, guests can choose from a selection of tapas-style dishes which, despite the name, are inspired by traditional Italian and regional classics and have little to do with Spain. The gourmet menu features successful dishes such as sweetbreads, fettuccine and cod, as well as pasta with peas. The main courses include meat and fish.","40.8344895","14.2402287"
"673","Nobuya","Via San Nicolao 3/a, Milan, 20123, Italy","True","True","Japanese Contemporary","€€€","Nobuya boasts a minimalist elegance that is typical of Japanese restaurants, with brown tables, dark wooden beams on the ceiling, attractive subdued lighting, plus an illuminated wine cabinet to add a touch of colour. Here, the talented Japanese chef creates top-quality cuisine using the freshest ingredients. At lunchtime, there’s also a lighter “Bento box” and an omakase tasting menu (“Mi affido a te”) which is completely vegetarian.","45.46655","9.17683"
"674","Almondo Trattoria","piazza Gran Madre di Dio 2/l, Turin, 10131, Italy","False","False","Italian","€€","This simple yet charming restaurant located just a few metres from the Gran Madre church serves a fine array of regional Italian dishes. Although specialities from Piedmont understandably take pride of place, the menu takes guests on a culinary journey throughout Italy and the changing seasons, featuring dishes such as scialatielli pasta with seafood, Puglian stuffed meat rolls, and zabaglione with traditional hazelnut cake from the Langhe. There’s also a good selection of gluten-free options.","45.0622509","7.6985608"
"675","Truth Restaurant","via Fratelli Cervi 18, Aversa, 81031, Italy","False","False","Mediterranean Cuisine","€€","A contemporary-style restaurant with an open-view kitchen where two different styles of cuisine can be enjoyed: creative tapas influenced by different traditions, or more classic local dishes. The restaurant is particularly renowned for its choice of around a dozen imaginative small appetisers.","40.960971","14.2101034"
"676","Il Piraña","via G. Valentini 110, Prato, 59100, Italy","False","True","Seafood","€€€","A classic fish restaurant that opts for simply prepared dishes rather than fussy, inventive avant - garde cuisine. The perfect address for those in search of traditional fare.","43.8678128","11.0966872"
"677","Abba","via Varesina 177, Milan, 20156, Italy","False","True","Contemporary","€€€","Situated in the Certosa district, this modern and minimalist-style restaurant boasts an open-view kitchen, where the chefs at work also serve and explain their dishes throughout the evening. The choice here is between two tasting menus, while at midday those with limited time can choose three individual courses from the menus, à la carte style. Whatever you choose, this is a restaurant that contributes new, interesting cuisine to the options available in Milan thanks to its creative, contemporary dishes. Excellent bread, plus definite hints of Puglia, chef Abbattista’s native region.","45.5035705","9.1383706"
"678","Caruso Roof Garden","via Partenope 45, Naples, 80121, Italy","True","True","Campanian","€€€€","In a city that has its fair share of roof-garden eateries, this restaurant stands out as one of the most popular with fine panoramic views that take in the Castel dell'Ovo, Capri, the Sorrentine peninsula and Vesuvius... and, of course, the sea! Here, chef Emanuele Petrosino showcases the best of his cuisine on his tasting menus, which include “Suite 531” (dedicated to the legendary tenor Enrico Caruso), “Nel Blu”, “Per Mano” and “A Modo Mio”. If you’re choosing from the à la carte, we highly recommend the potato gnocchi with sea urchin, flavoured with Amalfi lemons and capers. Whatever you choose here, Campania’s fine produce takes centre stage, along with professional, attentive service and the beautiful Bay of Naples.","40.8299478","14.248257"
"679","Il Tartufo","via Guido Rossa 13, Revere, 46036, Italy","False","False","Country cooking","€€","Housed in a small villa in the residential area of the village, this intimate and secluded restaurant serves delicious cuisine with distinctly regional roots. In season, locally sourced truffles take centre stage, while fish and seafood dominate the menu at other times of year.","45.0468267","11.1275709"
"680","Quintilio","via Gramsci 23, Altare, 17041, Italy","True","True","Country cooking","€€","For over a century, and from generation to generation, Quintilio has acted as a junction between two beautiful regions, Liguria and Piedmont – and not just in a geographical sense. These regions take pride of place on the wine list (overseen by the friendly and talented owner Lorena) as well as on the menu, which is created daily with dishes made from top-quality local ingredients full of flavour. Regional specialities such as plin, Ligurian-style rabbit tortelli, risottos, vitello tonnato (veal) and brain are all skilfully reinterpreted with a modern twist by owner-chef Luca Bazzano.","44.3327751","8.3468894"
"681","Il Credenziere","via Quattro Strade 12, Annone Veneto, 30020, Italy","False","True","Seafood","€€","Situated in a small country hamlet, this restaurant is run by a chef from Puglia, whose origins can be glimpsed here and there in his dishes. The influence of the Veneto, where the chef has been working for some time, is also evident in the local dishes which appear alongside more creative options on the menu.","45.7923516","12.6932484"
"682","Hostaria del Pavone","via Barbarotta 15/17, Vasto, 66054, Italy","False","False","Seafood","€€€","A small gem for fish enthusiasts, this delightful restaurant situated amid the alleyways of the historic centre (just 2 minutes’ walk away) boasts a quiet ambience with a white colour scheme and minimalist decor chosen by the exuberant owner. Although the menu focuses on fish and seafood (the raw fish dishes are superb), the pasta dishes and main courses are also excellent. To round off a delightful dining experience, the wine list includes some surprising top-quality labels. A must!","42.1124503","14.710181"
"683","Trattoria la Rosa 1908","via del Bosco 2, ang. via Facchini, Sant'Agostino, 44047, Italy","True","False","Country cooking","€€","Situated on the outskirts of Ferrara, this reliable, classic-style restaurant now run by the fifth generation of the same family serves carefully prepared cuisine based around local ingredients. Highlights include truffles, sometimes served with fettuccine, butter and parmesan cheese, and the “sformato dell’Artusi” (a type of flan), served with a classic and intensely flavoured velouté.","44.7905538","11.380013"
"684","Frosch Restaurant","via Santi Pietro e Paolo 1, Varena, 38030, Italy","True","True","Contemporary","€€€","Situated in the centre of the small village of Varena (just outside the more famous Cavalese), this romantic and intimate restaurant with modern comforts and a mountain ambience is home to a talented female chef. Her contemporary recipes focus on local produce combined with Mediterranean flavours in some of the fish dishes and international ingredients such as foie gras.","46.3021115","11.4565016"
"685","Exé Restaurant","via Circondariale San Francesco 2, Fiorano Modenese, 41042, Italy","False","False","Italian","€€","This pleasant, elegant and contemporary-style restaurant on the ground floor of the Executive Spa Hotel boasts spacious dining rooms and an extensive menu ranging from traditional dishes to raw fish options, grilled meats (aged by the restaurant itself) and gourmet pizzas. The wine list features an impressive selection of labels, including by the glass, while the talented sommelier will delight wine-enthusiasts with his willingness to open almost any of the bottles in his cellar.","44.5378933","10.824509"
"686","Carusu","passeggiata Archeologica 8, Agrigento, 92100, Italy","False","False","Creative","€€€","Situated on the road that crosses the archaeological park, this smart and elegant restaurant boasts two dining rooms arranged on two floors. In the kitchen, a young chef with plenty of previous experience working in renowned restaurants creates reinterpreted Sicilian dishes of the highest quality.","37.2983958","13.5908391"
"687","Amo Bistrot","Vicoletto Due Mori 5, Verona, 37121, Italy","False","True","Fusion","€€","Traditional features such as exposed stone walls and wooden ceilings provide a pleasant contrast to the contemporary-style furnishings at this restaurant housed in the charming Palazzo Forti, while the attractive cloister with its old walls and soft lighting is highly recommended in the hot summer months. The cuisine combines traditional meat and fish dishes with Asian fare, including the option of sharing small dishes such as tapas or bao (steamed buns). There’s also an excellent brunch on Sundays.","45.4446546","10.9983826"
"688","Evo Ristorante","via Giovanni XXIII 1, Alberobello, 70011, Italy","True","True","Creative","€€€","This restaurant at the entrance to the historic centre boasts a delightful garden which leads to a porch where tables are set out in summer – an enchanting setting that feels as though you’re eating in the countryside despite the village location. The chefs’ imagination knows no bounds in complex and elaborate dishes that focus on ingredients from Puglia and are grouped into themed tasting menus.","40.7875418","17.2350877"
"689","San Baylon","via di Ripetta 232, Rome, 00186, Italy","False","True","Contemporary","€€€","Not far from Piazza del Popolo and Rome’s most exclusive shopping streets, this restaurant is situated in the Palazzo Ripetta hotel, in what was once the refectory of a 17C convent. Today, the ambience here is more informal, with an almost bistro-like feel, while the cuisine is inspired by classic Italian dishes, including various grilled options among the main courses. Meals are served in the palazzo’s inner courtyard in fine weather.","41.9084995","12.4759096"
"690","Locanda Toscano","via Benedetto Musolino 22, Pizzo, 89812, Italy","True","True","Contemporary","€€","This attractive restaurant with delightful views seems to be perched on the cliff, whereas in fact it’s situated just a stone’s throw from the town’s main piazza and Murat castle. Although inspired by Calabria’s maritime traditions, the contemporary-style cuisine also includes a few meat dishes.","38.7359154","16.1603839"
"691","L’Alchimia","viale Premuda 34, Milan, 20129, Italy","True","False","Modern Cuisine","€€€","The parquet floor, wood-beamed ceiling and exposed brickwork lend a warm ambience to this restaurant, which is bright and airy during the day and romantic in the evening thanks to its soft lighting. With Giuseppe Postorino at the helm, the cuisine here includes classic recipes alongside more personalised dishes all prepared using top-quality ingredients that are typical of Italian cuisine. Additional features include a small, beautiful brick-vaulted wine cellar (open to visitors), plus an adjacent bar-bistro which serves quick lunches and excellent aperitifs.","45.4657917","9.2074636"
"692","Io e Luna","località Montebello 1, Guarene, 14012, Italy","True","True","Regional Cuisine","€€","This classic-style restaurant serving updated regional cuisine offers views of the surrounding hills from its attractive outdoor terrace.","44.7450662","8.0147385"
"693","Il Giurista","via Bartolo 30, Perugia, 06122, Italy","False","True","Regional Cuisine","€€","This restaurant is named after Bartolo da Sassoferrato (as is the street on which it stands), a distinguished 14C jurist. From the street, you head down a few steps to the welcoming dining rooms with their historic ambience and brick-vaulted ceilings that keep the temperature pleasantly cool. The cuisine, which focuses exclusively on meat, is traditional and regional in flavour – an entire section of the menu is dedicated to black truffles in season. Friendly and attentive service.","43.113269","12.38963"
"694","Bar à Fromage","rue Grand Paradis 20, Cogne, 11012, Italy","False","False","Cuisine from the Aosta Valley","€€","A cosy, elegant Stube-style restaurant where the staff wear typical Aosta Valley costume and the menu features dishes with a particular focus on cheese (including an excellent fondue!) alongside traditional regional fare. Typical decor with refined, personalised furnishings and a profusion of wood.","45.6066147","7.3558181"
"695","Da Cesare","via Crescenzio 13, Rome, 00193, Italy","True","False","Classic Cuisine","€€","As the Florentine lily on the glass at the entrance implies, the specialities of this place are Tuscan in origin as well as seafood. Friendly atmosphere, ample wine list.","41.9053961","12.467996"
"696","Forte del 48","Via Carlo Vizzotto 1, San Donà di Piave, 30027, Italy","True","True","Venetian","€€","This pleasant restaurant started life in 1848 as a bastion used by the Habsburg army and was later transformed into an inn. Recognised as a “Locale Storico Veneto”, it’s now run by the third generation of the De Faveri family who serve traditional meat and fish dishes here. Comfortable guestrooms are also available for guests wishing to extend their stay.","45.630695","12.575539"
"697","Bistrot 64","via Guglielmo Calderini 64, Rome, 00196, Italy","False","True","Creative","€€€","The classic-style dining room in this restaurant situated in the Flaminio district belies the gourmet discoveries that await here, with echoes of traditions from Lazio that act as inspiration for creative, top-quality dishes with the occasional Asian twist.","41.93046","12.466211"
"698","Lazaroun","via Del Platano 21, Santarcangelo di Romagna, 47822, Italy","True","True","Cuisine from Romagna","€€","The prototype of a typical Romagna restaurant, run by an efficient and friendly family team. Excellent choice of high - quality first and second courses, including fresh pasta, hams and salamis, meat options and grilled dishes. An interesting feature of the restaurant is the presence of ancient tufa caves in the basement. Created around 400 AD and part of an intricate network of underground passages, they were later used by the Malatesta family as an escape route and are now open to the public.","44.0640548","12.4443162"
"699","Degusteria Italiana","via Lambertesca 7r, Florence, 50122, Italy","False","False","Italian Contemporary","€€€","This small, welcoming restaurant in the heart of the city, not far from the Uffizi Gallery, specialises in three typical Italian ingredients, namely cheese, truffles and game, from which it creates intriguing and delicious dishes.","43.7686986","11.2547137"
"700","Cavallino","corso Romita 83, Tortona, 15057, Italy","False","False","Modern Cuisine","€€€","Three talented young entrepreneurs who are passionate about good food have taken over this historic restaurant and have given it a new lease of life. The cuisine is contemporary and imaginative, with a firm focus on the region. Local cuisine is also to the fore in the simpler and more informal Trattoria da Ciccio.","44.9005761","8.8663602"
"701","Il Giardino del Gusto","piazza XX Settembre 6/c, Ventimiglia, 18039, Italy","True","False","Creative","€€€","Although not on the seafront, this restaurant is well worth a visit thanks to its excellent owner - chef, who has had years of experience to perfect his French culinary techniques. Exciting tasting menus with dishes which can also be ordered à la carte.","43.7922524","7.6085164"
"702","Derby Grill","viale Cesare Battisti 1, Monza, 20900, Italy","True","True","Italian Contemporary","€€€","Situated opposite the Villa Reale, this restaurant has the same classic, vaguely British ambience as the Hotel de la Ville in which it is situated, with tables also laid out on its elegant adjoining veranda. The menu features carefully prepared creative meat and fish dishes as well as traditional specialities from Lombardy, including risotto with Monza luganega sausage, ossobuco with gremolata parsley sauce and saffron rice, and an excellent costoletta alla Milanese (breaded veal).","45.5927421","9.2713814"
"703","Foresta","via Litoranea 2, Marina di Pisa, 56128, Italy","True","False","Seafood","€€€","Overlooking the Tyrrhenian Sea, all the tables at this restaurant offer sea views, whether you’re sitting in the winter dining room or on the outdoor summer terrace. The menu here focuses on top-quality fish dishes, which are classic in style, as is the background music and wine list, although the desserts have a more imaginative flavour.","43.6591027","10.2798543"
