"ID","Nome","Indirizzo","Delivery","Prenotazione online","Tipo cucina","Prezzo","Descrizione","Latitudine","Longitudine"
"361","sui generis.","via Roma 35, Saronno, 21047, Italy","True","True","Creative","€€€€","A modern dining-room with an open-view kitchen where young Alfio Nicolosi can be observed at work, ably assisted by friendly and attentive staff front of house. When you book, you’ll be asked if you have any food allergies or intolerances, or any ingredients that you don’t like, as there is just one surprise tasting menu served here. The truly extraordinary dishes are inspired by the chef’s remarkable knowledge of culinary traditions from Italy and further afield (strong Asian and South American influences are obvious), resulting in highly personalised dishes. Nicolosi is one of the most interesting young chefs in Italy at the moment and his exciting cuisine is full of intense flavours, including grilled dishes with a hint of street food and other influences apparent throughout.","45.6249766","9.0412055"
"362","Il Fuoco Sacro","strada di Buddeo, San Pantaleo, 07026, Italy","True","False","Italian","€€€€","Situated in the magical, rural and secluded setting of the Petra Segreta resort, surrounded by Mediterranean maquis scrubland, the gourmet Il Fuoco Sacro restaurant overlooks a delightful garden and boasts stunning views of the coast. The founder of this hidden paradise is chef-cum-entrepreneur Luigi Bergeretto, who serves modern, Mediterranean cuisine with a focus on locally sourced ingredients, including the excellent aromatic herbs grown on the hotel farm (which also provides the resort with its vegetables, cheeses and some meat). Last but not least, the menu is overseen by Enrico Bartolini – a 100% guarantee of a fine gourmet experience!","41.0529512","9.4460803"
"363","Contrada","località Monastero d'Ombrone 19, Castelnuovo Berardenga, 53019, Italy","True","True","Modern Cuisine","€€€","In the charming setting of an old hamlet, chef Davide Canella, who has plenty of experience behind him, serves delicious, elegant cuisine presented on a tasting menu and an à la carte on which meat takes centre stage (although a few fish options also feature). Dishes include exquisite prawns and panzanella, and duck breast served with hosomaki. Manuela, the friendly, professional sommelier, oversees the front of house, offering excellent recommendations on the best wine pairings. In other words, a delightful all-round dining experience thanks to the competence and enthusiasm of all involved.","43.3510435","11.56022"
"364","Il Cantuccio","via Dante 32, Albavilla, 22031, Italy","False","False","Modern Cuisine","€€€","This welcoming, beautifully kept restaurant in the heart of green Brianza has a romantic and elegantly rustic feel. Here, enjoy opulent and generous cuisine created by chef Mauro Elli who moves easily between classic Italian favourites, occasionally adding his own individual touch to the dishes. His imaginative reinterpretations demonstrate a fascination with the sea (despite the restaurant’s geographical location), while the menu also offers “daily game specials” throughout the year. The focus here is on serving dishes full of flavour, rather than following passing trends.","45.8042803","9.1891665"
"365","La Palta","Località Bilegno, Borgonovo Val Tidone, 29011, Italy","True","True","Country cooking","€€€","Situated on the plain at the foot of the hills visible in the distance, this restaurant resembles a typical country house with an elegant dining room extending into a kind of covered veranda, the windows of which open on to the garden and the greenery of the Bassa Piacentina countryside. The ambience here is pleasant and relaxed, perfect for an elegant dining experience, yet not too formal. Although the menu features local ingredients and recipes, such as the excellent focaccia (bread is a house speciality) served with ciccioli(pork scratchings), the cuisine is creative without being overly fussy, and aims to please rather than amaze the palate. Our inspector recommends the roast donkey meat with “saracca” (herring) and “gorgnalini” – the latter is wild chicory, which adds a bitter taste and dash of bright green to an exquisite dish.","44.9922314","9.4694233"
"366","Il Falconiere","Località San Martino a Bocena 370, San Martino, 52044, Italy","True","True","Tuscan","€€€€","To get to this exclusive restaurant, you drive through an idyllic landscape of small lanes lined with dry-stone walls and fields belonging to the Baracchi farm estate, of which Il Falconiere and the magnificent hotel of the same name are a part. Many of the ingredients served here, such as wine and olive oil, are produced on the estate and the restaurant’s strong connection with its local landscapes is evident. Specialities such as Chianina beef, local garlic and pici pasta feature in dishes spiced with aromatic herbs and full of the strong flavours of Tuscany.","43.2821868","11.9763509"
"367","Il Desco","via Dietro San Sebastiano 7, Verona, 37121, Italy","False","True","Italian Contemporary","€€€€","For more than 40 years, this refined, elegant restaurant housed in a Renaissance-style palazzo in the heart of Verona and embellished with beautiful works of art has been the city’s “drawing room”, making it the perfect choice for a special occasion. The menu showcases renowned classic recipes created by talented chef Elia Rizzo, who has now been replaced by son Matteo in the kitchen. Most of the dishes are created by Matteo and have a light, fresh flavour (the scallops in a Mediterranean tandoori masala are superb), although there are also many of his father’s signature dishes on the menu, such as the memorable butter and mascarpone mousse served with bread at the beginning of the meal. The interesting “Capitolo 4” tasting menu explores traditional, regional flavours and includes some of the restaurant’s iconic dishes spanning the period from when it opened in 1982 to the current day.","45.4416145","10.9999722"
"368","Il Bavaglino","via dei Mille 2/b, Terrasini, 90049, Italy","True","True","Creative","€€€","Although this restaurant now occupies new premises in an old building once used for salting fish, its style of cuisine (featured on three tasting menus, “Storie e passioni”, “Mura di Casa”, and the vegetarian “Erba Terra Foglie”, from which dishes can also be chosen à la carte style) remains unchanged. Inspired by regional traditions, chef Giuseppe Costa creates personalised and imaginative dishes that are influenced by local flavours and his past culinary experience, proving himself to be equally at ease with fish and meat options. Our inspector particularly recommends the local purple prawns, served raw with caviar and olives and a lemon and ginger coulis.","38.1556478","13.0812287"
"369","I Pupi","via del Cavaliere 59, Bagheria, 90011, Italy","True","False","Sicilian","€€€€","Situated amid the streets of the old town, this restaurant boasts an intimate dining room and a pleasant outdoor space with a corner where guests can watch the appetisers being prepared. Chef Tony Lo Coco showcases Sicilian flavours and ingredients (meat and fish alike) which he transforms into personalised and imaginative dishes. His recipes often reinterpret great Sicilian classics, as is the case with his swordfish involtini where the traditional whipped filling is replaced by a cream on which the fish is placed and surrounded by ginger foam, or the famous cassata which he transforms into a transparent bubble in which all the different ingredients are then arranged. Elegant and professional service adds to the enjoyment of the experience.","38.0803301","13.5116679"
"370","Al Gambero","via Roma 11, Calvisano, 25012, Italy","False","True","Lombardian","€€€","A long-established restaurant in the Lower Brescia region, where the elegant, meticulous service is skilfully overseen by the owner, Al Gambero is the perfect choice for anyone in search of cuisine that is full of flavour and prepared using skilful, modern techniques, and in which taste is everything. The restaurant opened in 1880 in the oldest house in the village and is now run by descendants of the same family. After so many years in business, the menu has accumulated a number of unmissable signature dishes, from its famous risottos to roast kid.","45.3492146","10.3430573"
"371","Dissapore di Andrea Catalano","via Pietro Micca 15, Carovigno, 72012, Italy","False","False","Modern Cuisine","€€€","Don’t be put off by the maze of narrow streets leading to this restaurant in the historic town – once you reach your destination, you’ll enjoy delicious classic recipes from Puglia prepared using top-quality ingredients and full of unmistakeable flavours, all served in a charming dining room with lime and stone walls crowned by a domed ceiling. Among the highly recommended dishes, don’t miss the “purely instinctive” scampi with sweet pepper and saffron. Wines from Puglia, elsewhere in Italy and further afield accompany chef Andrea’s eclectic cuisine, while front of house, bubbly and friendly Franca oversees the excellent service. In summer, don’t miss the outdoor terrace overlooking the village rooftops with views of the sea in the distance!","40.7073742","17.6581893"
"372","Locanda del Pilone","frazione Madonna di Como 34, Alba, 12051, Italy","True","False","Creative","€€€","Situated just a few kilometres from the town, this restaurant stands on a hill with 360° views of some of the most breathtaking vineyard scenery in the area, where vines stand in neat rows extending into the distance and take on extraordinary colours in autumn. Here, in a classic and elegant setting, the cuisine features seasonally inspired dishes (on a tasting menu which can be mixed and matched à la carte style) created by a skilful and enthusiastic chef who has solid experience despite his relative youth. In summer, bistro options are also available on the splendid outdoor terrace.","44.66367","8.04705"
"373","Pashà","via Morgantini 2, Conversano, 70014, Italy","True","True","Apulian","€€€€","This restaurant housed in the immense and historic Palazzo del Seminario Vescovile (Bishop’s Seminary) boasts a plain yet elegant interior decor, outstanding service and reinterpreted regional cuisine, all of which contribute to a very pleasant dining experience. The cuisine focuses on the region, with the occasional influence from Sicily, the chef’s homeland. Highlights on the menu include caviar and caprese (Altamura buffalo mozzarella with beluga caviar and a cherry tomato salad), and lamb with shallots in which the full flavours and tender textures of the meat shine through. As there’s only one tasting menu, remember to mention any food intolerances or preferences when you book. And when it comes to choosing your wine, make sure you ask talented sommelier Juan Pablo for recommendations – he will delight in taking you on a world tour which includes some really interesting labels!","40.9691184","17.1151639"
"374","Saporium","località Palazzetto 110, Chiusdino, 53012, Italy","True","True","Tuscan","€€€€","Saporium is the new fine-dining restaurant at the superb Relais Borgo Santo Pietro, an old property where the internal decor demonstrates a rare elegance, especially in the evening when hundreds of candles provide soft lighting and a romantic ambience in the dining room. In fine weather, meals are served under an elegant 13C portico overlooking the garden, with the property’s 100ha grounds and the Valle Serena as a backdrop. Much of the produce used in the cuisine (designed by executive chef Ariel Hagan and transformed by resident chef Luca Ottogalli into modern, delicate dishes) comes from the hotel’s own olive groves, vineyards, orchards and vegetable gardens. The focus here is on seasonal ingredients from this extraordinary region – the saddle of hare with cavolo nero and pear is a perfect example! A whole host of wine-pairing options are possible thanks to a wine list featuring over 1 300 labels. We recommend trying one of the Borgo’s own wines, such as the harmonious and elegant Pinot Nero.","43.1414359","11.1278724"
"375","La Stüa de Michil","strada Col Alt 105, Corvara in Badia, 39033, Italy","False","False","Creative","€€€€","To get to this restaurant you head up towards the church in the prettiest part of Corvara, where you’ll find the La Perla hotel, one of the best in the valley, on your left. Once inside the hotel, you’ll be accompanied to La Stüa (stube in Ladin), where the profusion of wood lends an intimate and romantic feel to the decor. Although the setting is typical of the region, Simone Cantafio’s cuisine will take you on an extraordinary culinary journey. Originally from Calabria, this chef worked for many years in Japan, just one of his many formative experiences. As a result, his dishes feature different influences, often with a focus on vegetables. The name of the restaurant is a reference to owner and manager Michele Costa, an indefatigable and extraordinary figure in the world of Ladin tourism.","46.5471597","11.8762348"
"376","Due Colombe","via Foresti 13, Borgonato, 25040, Italy","True","True","Country cooking","€€€","At this restaurant, the chef’s highly creative approach does not ignore his culinary roots, resulting in a successful reinterpretation of local peasant traditions and top-quality cuisine. Our inspectors highly recommended making your way to this thousand-year-old hamlet, where you dine in a deconsecrated church under a brick-vaulted ceiling. The fine cuisine celebrated here includes historic dishes that have become classic favourites, which can be chosen from the three tasting menus. A good example is the beef cooked with olive oil and served with polenta: “Nonna” Elvira made this dish in the post-war period and her grandson Stefano follows the same recipe today. The menu also includes a few fish dishes, while wine-enthusiasts shouldn’t hesitate to ask sommelier Federica for her recommendations – they won’t regret it!","45.62138","10.018"
"377","Il Tino","via Monte Cadria 127, Fiumicino, 00054, Italy","False","True","Creative","€€€","Enjoying an attractive location in the Nautilus Marina, overlooking the Tiber and the boats moored along it, this restaurant decorated in a modern, minimalist style represents a childhood dream for its chef, who learned his craft from observing his grandparents, both of whom were excellent cooks. Following years spent gaining experience abroad and in Italy, including an informative period with Gualtiero Marchesi at L’Albereta, Usai now creates contemporary cuisine with a strong regional character, prepared from top-quality seasonal ingredients and enhanced with cutting-edge techniques. His cuisine is also open to more exotic influences, including from Asia, the aesthetic quality of which reflects the chef’s own love for elegant presentation. The restaurant’s kitchen garden, visible from the steps leading into the dining room, provides the many herbs that are used skilfully by the chef to add colour and even more flavour to his delicious fish and seafood dishes. Excellent wine list, plus the highly recommended option of starting your meal with an intriguing cocktail!","41.747204","12.257445"
"378","Nin","via Zanardelli 5, Brenzone sul Garda, 37010, Italy","True","False","Creative","€€€€","Chef Terry Giacomello has taken inspiration from his travels around the world to create his NIN menu, while his CLASSICI option focuses on Italian favourites. His cuisine features a combination of modern techniques and classic influences, with an added dose of creativity and innovation. Although the first-floor dining room overlooks Lake Garda, only a fortunate few will have a table with a view, so booking in advance is recommended!","45.7154863","10.7716421"
"379","Kuppelrain","via Stazione 16, località Maragno, Castelbello, 39020, Italy","True","False","Farm to table","€€€","The many positive adjectives that can be used to describe the Trafoier family can be summed up by simply saying that they are unique! Their individual talents come together in the natural and engaging welcome they offer guests, demonstrating a warmth and professionalism that is typical of the Kuppelrain experience. Chef Kevin, who is as skilful as his father Jorg (now front of house), demonstrates precise, excellent techniques in his search for comforting and appealing flavours that bring out the full flavour of his ingredients with no frills or unnecessary fuss. Local produce takes pride of place, such as fruit and vegetables from the restaurant’s own kitchen garden, and meat and fish from the region. The desserts, as well as the imaginative pralines, are made by daughter Natalie. Wine-enthusiasts will also be in their element here, thanks to the excellent wine list (including a fine selection by the glass, as well as magnums and 3-litre double magnums) which is overseen by talented Sonya (the winner of the 2022 Michelin Sommelier Award!), who creates unique wine pairings. Bistro service only at lunchtime.","46.6264329","10.8975683"
"380","L'Asinello","via Nuova 6, località Villa a Sesta, Castelnuovo Berardenga, 53019, Italy","True","False","Tuscan","€€€","Situated at the entrance to a romantic village in the Chianti region, this former stable has been converted into a quiet, elegant restaurant by a young couple, with a beautiful garden for summer dining. Here, guests can sit after dinner and enjoy the sound of neighbours calling to each other in the background, a pleasant reminder of life in Italy in days gone by. At the helm in the kitchen, the husband champions traditional cuisine which is minimalist in its choice of flavours and made from just a few well-balanced ingredients. The impeccably kept garden, which is as beautiful and well presented as his dishes, is also the chef’s work (he certainly has green fingers!). A real Italian culinary gem!","43.385393","11.4808519"
"381","Un Piano nel Cielo","via Capriglione 147, Praiano, 84010, Italy","False","True","Mediterranean Cuisine","€€€€","A delightful panoramic lift leads from the Casa Angelina hotel to this restaurant where, in fine weather, meals are served on the candlelit terrace with its breathtaking views of the coast. Chef Leopoldo Elefante creates Mediterranean cuisine with a focus on fish and seafood, including his signature dentex (a kind of sea bream) – a classic dish with a light modern touch featuring baked Tyrrhenian fish escalope served on diced potatoes and cherry tomatoes with a clam sauce. The menu also includes a few excellent meat specialities. The chef here takes great care with presentation, arranging each ingredient on the plate with attentive precision while also working quickly in order to ensure that dishes are served at the right temperature. He is ably assisted by a friendly and attentive team front of house, where an impressive wine list of over 1 000 labels will delight wine-lovers, especially those keen on French and Italian sparkling wines.","40.6136373","14.5218291"
"382","Materia","via Trieste 1/B, Cernobbio, 22012, Italy","False","True","Creative","€€€","While this restaurant’s recent move has brought a new setting and a change of address, it continues to serve cuisine which is a fusion of Italian, Asian and other influences, with a menu featuring plenty of vegetables, spices and aromatic herbs used by the chef to create dishes full of concentrated flavours. If you enjoy innovative and original combinations, this is the restaurant for you as many of the dishes on the menu (including the desserts) offer something different, including recipes with more challenging and acidic and bitter flavours. Our inspector particularly enjoyed the pickled whitefish served with roe and bitter local salad leaves. In addition to the à la carte, there’s also a lighter menu available at lunchtime.","45.8383599","9.0685195"
"383","Essenza","via Cavour 38, Terracina, 04019, Italy","True","True","Creative","€€€","Simone Nardini’s Michelin star continues to shine in Terracina in this elegant restaurant which is run by young, well-trained staff. The chef serves exciting, creative cuisine, with a careful preparation and presentation of dishes that will appeal to the eyes and tastebuds alike. There’s also an impressive wine list featuring around 800 different labels.","41.287274","13.2566963"
"384","Acqua","via Filippo Corridoni 1, Olgiate Olona, 21057, Italy","False","True","Seafood","€€€","The Possoni continue with their family tradition in this contemporary-style restaurant situated opposite the long-established Ma.Ri.Na. Here, their emphasis is on the quality of ingredients, which is always of paramount importance to chef Menoncin and owner Davide Possoni, who at the beginning of the evening will accompany you to your table and advise you on your choices from the menu. Fish and seafood take centre stage here, showcased in simple, traditional dishes and more complex and creative recipes alike. The menu always features a few raw options, such as the trio of shellfish (scampi, red prawns and what must surely be the largest shrimps you’ve even seen), each of which is served with its own creative and delicate dressing. The wine list includes a number of labels from the Champagne region, plus numerous wines available by the glass. An attractive outdoor space completes the picture.","45.6346559","8.8878287"
"385","I Tenerumi","via Vulcanello, Isola Vulcano, 98055, Italy","True","True","Vegetarian","€€€€","We recommend arriving at this restaurant before the sun goes down so that you can enjoy the spectacular sunset in this breathtaking setting with its view of the Aeolian islands. Meanwhile, skilful chef Davide Guidara’s cuisine is just as exciting as the setting, thanks to his single tasting menu prepared in the open-view kitchen. The menu features around twenty small plates prepared by this young and exceptionally talented chef – it’s no surprise that he has already won Michelin’s Best Young Chef award. He enjoys playing with culinary techniques and makes the most of his home-grown produce by using preservation methods such as fermentation, maceration, pickling and salting and then using these preserves along with seasonal ingredients in his dishes. His decidedly personalised cuisine can be paired with original vegetable cocktails (most of which are non-alcoholic), although wine-enthusiasts will be pleased to hear that a wine list is also available. The excellent desserts are prepared by top pastry chef Gianluca Colucci, while the young front-of-house team help to make the evening special with their friendly, attentive service and their ability to put guests immediately at ease. I Tenerumi is a truly unmissable gastronomic experience!","38.4305495","14.9560516"
"386","Orma Roma","via Boncompagni 31, Rome, 00187, Italy","True","True","Fusion","€€€€","An oak door with three steps leads into the dining room which extends towards the kitchen in this restaurant designed by a renowned Milanese studio, whose predilection for wood is typified by the beautiful oval-shaped dining tables. Famous chef Roy Caceres (originally from Colombia but now decidedly Roman) is at the helm here, serving a successful combination of ingredients from Lazio and his native country with occasional influences from elsewhere in Italy. The menu features dishes such as Abruzzo mutton with ‘nduja sausage served with Castelfranco radicchio. The chef is happy to introduce himself and share his ideas with guests, adding to the sense of welcome and conviviality here. The wine cellar is as well thought out as the dining room, offering the perfect venue for a quick aperitif, while in summer the outdoor terrace comes into its own for cocktails and bistro dining.","41.9084005","12.4933748"
"387","Iris Ristorante","Via Leoni 10, Verona, 37121, Italy","True","True","Contemporary","€€€€","Not far from the 12C Basilica di San Fermo, this restaurant is housed in the Palazzo Soave (formerly Palazzo Malaspina Bottagisio). This historic address boasts highly elegant rooms with the “fishbone”-style stonework typical of Roman buildings and vaulted ceilings that provide a pleasant contrast to the restaurant’s contemporary furnishings. Your meal begins a journey back through the city’s history, as appetisers are served in their own special setting in the palazzo’s 14C wine cellar which has Roman origins, after which you return to the dining room to enjoy the rest of your meal. The talented chef here creates regionally influenced, balanced and imaginative dishes with a “green” focus. The menu also features fish, especially from the Adriatic, while the wine list boasts over 800 labels with a particular emphasis on France and the Veneto.","45.4397874","11.0005401"
